id,index,quote,author
0,20250405,"O que você procura está procurando você.","Rumi"
1,20250406,"Uma meta é um sonho com um prazo.","Napoleon Hill"
2,20250407,"Tente mover o mundo - o primeiro passo será mover a si mesmo.","Platão"
3,20250408,"Disciplina é a ponte entre metas e realizações.","Jim Rohn"
4,20250409,"Sorte é o que acontece quando a preparação encontra a oportunidade.","Elmer Letterman"
5,20250410,"Quem quer vencer um obstáculo deve armar-se da força do leão e da prudência da serpente.","Píndaro"
6,20250411,"Uma longa viagem começa com um único passo.","Lao Tzu"
7,20250412,"Existe apenas um canto do universo que você pode ter certeza de aperfeiçoar, que é você mesmo.","Aldous Huxley"
8,20250413,"Você precisa fazer aquilo que pensa que não é capaz de fazer.","Eleanor Roosevelt"
9,20250414,"Se você quiser que as coisas mudem, primeiro você tem que mudar.","Rachel Bright"
10,20250415,"A chave do sucesso é começar antes de estar pronto.","Marie Forleo"
11,20250416,"Ganhar não é tudo, mas querer ganhar é.","Vince Lombardi"
12,20250417,"Algumas pessoas querem que aconteça, algumas esperam que aconteça, outras fazem acontecer.","Michael Jordan"
13,20250418,"Não tenha medo de desistir do que é bom para ir atrás do que é ótimo.","John D. Rockefeller"
14,20250419,"Somos o que repetidamente fazemos. A excelência, portanto, não é um feito, mas um hábito.","Aristóteles"
15,20250420,"Acredite em milagres, mas não dependa deles.","Immanuel Kant"
16,20250421,"As realizações de hoje eram as impossibilidades de ontem.","Robert H. Schuller"
17,20250422,"Um vencedor é um sonhador que nunca desiste.","Nelson Mandela"
18,20250423,"Se você quer mudar os frutos, primeiro tem que trocar as raízes – quando deseja alterar o que está visível, antes deve modificar o que está invisível.","T. Harv Eker"
19,20250424,"Acredite em si próprio e chegará um dia em que os outros não terão outra escolha senão acreditar com você.","Cynthia Kersey"
20,20250425,"Você pode encontrar muitas derrotas, mas você não pode se deixar derrotar.","Maya Angelou"
21,20250426,"Ser você mesmo em um mundo que está constantemente tentando fazer de você outra coisa é a maior realização.","Ralph Waldo Emerson"
22,20250427,"Você tem de agir. E você tem que estar disposto a fracassar... Se você tem medo de fracassar, não irá muito longe.","Steve Jobs"
23,20250428,"A verdadeira motivação não é aquilo que te anima, mas aquilo que te transforma...","Bárbara Coré"
24,20250429,"Toda ação humana, quer se torne positiva ou negativa, precisa depender de motivação.","Dalai Lama"
25,20250430,"Eu faço da dificuldade a minha motivação. A volta por cima vem na continuação.","Charlie Brown Jr."
26,20250501,"Tudo o que um sonho precisa para ser realizado é alguém que acredite que ele possa ser realizado.","Roberto Shinyashiki"
27,20250502,"Lute com determinação, abrace a vida com paixão, perca com classe e vença com ousadia, porque o mundo pertence a quem se atreve e a vida é muito para ser insignificante.","Augusto Branco"
28,20250503,"A diferença entre o possível e o impossível está na vontade humana.","Pasteur"
29,20250504,"Você consegue o melhor dos outros quando você dá o melhor de você mesmo.","Harry Firestone"
30,20250505,"Tente de novo. Fracasse de novo. Fracasse melhor.","Samuel Beckett"
31,20250506,"O pessimista vê dificuldades em todas as oportunidades. O otimista vê oportunidades em todas as dificuldades.","Bertram Carr"
32,20250507,"Faça o que pode, com o que você tem, no lugar onde você está...","Theodore Roosevelt"
33,20250508,"Você não precisa ser ótimo para começar, mas precisa começar para ser ótimo.","Zig Ziglar"
34,20250509,"O melhor momento para plantar uma árvore foi há 20 anos. O segundo melhor momento é agora.","Provérbio chinês"
35,20250510,"É difícil vencer uma pessoa que nunca desiste.","Babe Ruth"
36,20250511,"Tudo o que você pode imaginar é real.","Pablo Picasso"
37,20250512,"A felicidade não é algo pronto. Ela surge de suas próprias ações.","Dalai Lama"
38,20250513,"Todos os seus sonhos podem se tornar realidade se você tiver coragem para persegui-los.","Walt Disney"
39,20250514,"Ninguém é tão grande que não possa aprender, nem tão pequeno que não possa ensinar.","Esopo"
40,20250515,"O homem que não tem imaginação, não tem asas.","Muhammad Ali"
41,20250516,"Ser feliz sem motivo é a mais autêntica forma de felicidade.","Carlos Drummond de Andrade"
42,20250517,"Não fique olhando o relógio, faça como ele: mexa-se.","Sam Levenson"
43,20250518,"Há sempre espaço no topo.","Daniel Webster"
44,20250519,"Se os teus sonhos não te assustam, eles não são grandes o suficiente.","Ellen Johnson Sirleaf"
45,20250520,"Se você pensa que consegue, ou que não consegue, você está certo.","Henry Ford"
46,20250521,"Você perde 100% das oportunidades que não aproveita.","Wayne Gretzky"
47,20250522,"Eu nunca falhei. Eu apenas encontrei 10 mil maneiras que não funcionam.","Thomas Edison"
48,20250523,"É melhor falhar na originalidade do que ter sucesso na imitação.","Herman Melville"
49,20250524,"Coragem é preparo e não mera disposição eufórica.","Mario Sergio Cortella"
50,20250525,"A motivação é uma porta que se abre por dentro.","Mario Sergio Cortella"
51,20250526,"A vida é 10% o que acontece a você e 90% como você reage a isso.","Charles Swindoll"
52,20250527,"A vida não é um problema a ser resolvido, mas uma realidade a ser experimentada.","Soren Kierkegaard"
53,20250528,"Quando vires um homem bom, tenta imitá-lo; quando vires um homem mau, examina-te a ti mesmo.","Confúcio"
54,20250529,"Todos os dias, faça algo que te assuste.","Eleanor Roosevelt"
55,20250530,"É maravilhoso que ninguém precise esperar um único momento antes de começar a melhorar o mundo.","Anne Frank"
56,20250531,"Transforme suas feridas em sabedoria.","Oprah Winfrey"
57,20250601,"Não seja controlado pelos medos da sua mente. Seja conduzido pelos sonhos do seu coração.","Roy T. Bennett"
58,20250602,"Você deve criar seu próprio livro de regras e viver sua vida da maneira que quiser.","Reese Evans"
59,20250603,"Ontem eu era inteligente, então queria mudar o mundo. Hoje sou sábio, então estou mudando a mim mesmo.","Rumi"
60,20250604,"Feito é melhor que perfeito.","Sheryl Sandberg"
61,20250605,"A melhor maneira de prever seu futuro é criá-lo.","Alan Kay"
62,20250606,"Nada vai embora até que nos ensine o que precisamos saber.","Pema Chodron"
63,20250607,"Seja a mudança que você deseja ver no mundo.","Mahatma Gandhi"
64,20250608,"A vida é como andar de bicicleta. Para manter o equilíbrio, você deve continuar se movendo.","Albert Einstein"
65,20250609,"A vida se encolhe ou se expande em proporção à sua coragem.","Anaïs Nin"
66,20250610,"Seja feliz neste momento. Este momento é a sua vida.","Omar Khayyām"
67,20250611,"A vida não é encontrar a si mesmo. A vida é criar a si mesmo.","George Bernard Shaw"
68,20250612,"Obstáculos são injeções de ânimo ou desânimo, você escolhe.","Fernando Faria"
69,20250613,"O otimismo é a fé em ação. Nada se pode ser feito sem otimismo.","Helen Keller"
70,20250614,"A coragem está um passo à frente do medo.","Coleman Young"
71,20250615,"Seja profundamente apaixonado pela vida. Pois a vida é um espetáculo imperdível.","Augusto Cury"
72,20250616,"A vida vale a pena quando você torce para ela não acabar.","Clóvis de Barros Filho"
73,20250617,"Quando você começa a caminhar, o caminho aparece.","Rumi"
74,20250618,"Em si, a vida é neutra. Nós a fazemos bela, nós a fazemos feia; a vida é a energia que trazemos a ela.","Osho"
75,20250619,"Escreva em seu coração: todo dia é o melhor dia do ano.","Ralph Waldo Emerson"
76,20250620,"A vida é uma prática. Você é aquilo que faz todos os dias.","Isaac Asimov"
77,20250621,"Os professores abrem a porta, mas você deve entrar por você mesmo.","Provérbio Chinês"
78,20250622,"Você é o que se habituou a ser.","Provérbio Árabe"
79,20250623,"Se você pode ir até o profundo do abismo, também poderá chegar ao topo da montanha!","Cesar Silva"
80,20250624,"Fale com você mesmo como falaria com alguém que ama.","Brené Brown"
81,20250625,"O propósito da vida é encontrar o maior fardo que você pode carregar e carregá-lo.","Jordan B. Peterson"
82,20250626,"Seguir em frente nos dá liberdade e a liberdade é a única condição para a felicidade.","Thich Nhat Hanh"
83,20250627,"O mundo que você anseia pode ser conquistado. Existe, é real, é possível, é seu.","Ayn Rand"
84,20250628,"A sabedoria não vem do acerto, mas do aprendizado com os erros.","Monja Coen"
85,20250629,"Nunca subestime o poder de sua visão para mudar o seu mundo.","Caio Carneiro"
86,20250630,"Você só vive uma vez. Por isso divirta-se.","Coco Chanel"
87,20250701,"E você? Quando vai começar aquela longa jornada dentro de si mesmo?","Rumi"
88,20250702,"o mundo<br>te dá<br>tanta dor<br>e aqui está você<br>transformando-a em ouro","Rupi Kaur"
89,20250703,"Fomos criados para avançar, crescer e subir a novas alturas. A nossa natureza é de crescimento, e isso implica esforço e trabalho duro.","Tiago Brunet"
90,20250704,"Às vezes, sua alegria é a fonte do seu sorriso, mas outras vezes, o seu sorriso pode ser a fonte da sua alegria.","Thich Nhat Hanh"
91,20250705,"Não existe um caminho para a felicidade. A felicidade é o caminho.","Thich Nhat Hanh"
92,20250706,"Você está onde está por causa de quem era, mas onde você vai depende inteiramente de quem você escolhe ser.","Hal Elrod"
93,20250707,"um dia<br>decidi ser eu<br>e nunca mais<br>voltei atrás","Ryane Leão"
94,20250708,"A incerteza é algo presente, desejável e necessário para a evolução.","Nassim Nicholas Taleb"
95,20250709,"Nunca confunda uma única derrota com uma derrota final.","F. Scott Fitzgerald"
96,20250710,"Ninguém é responsável pelo meu fracasso. Ninguém é responsável pela minha felicidade.","Leandro Karnal"
97,20250711,"Se você só tiver disposto a realizar o que é fácil, a vida será difícil. Mas se concordar em fazer o que é difícil, a vida será fácil.","T. Harv Eker"
98,20250712,"Tudo o que temos de decidir é o que fazer com o tempo que nos é dado.","J. R. R. Tolkien"
99,20250713,"Há momentos para ficar parado e o que você quer virá até você, e há momentos para sair para o mundo e encontrar isso por si mesmo.","Lemony Snicket"
100,20250714,"Se você quer voar, tem que largar aquilo que te puxa para baixo.","Toni Morrison"
101,20250715,"Este é o verdadeiro segredo da vida - estar completamente comprometido com o que você está fazendo aqui e agora.","Alan Watts"
102,20250716,"Nossa própria vida tem que ser nossa mensagem.","Thich Nhat Hanh"
103,20250717,"Você é o único representante de seu sonho na face da terra.","Emicida"
104,20250718,"Braços fortes podem mover rochedos, mas palavras fortes podem mover montanhas.","Sylvester Stallone"
105,20250719,"Os problemas são a base para continuar crescendo.","Tiago Brunet"
106,20250720,"Pare de procurar as tempestades e aproveite melhor a luz do sol.","Gordon B. Hinckley"
107,20250721,"Trabalho é amor tornado visível.","Khalil Gibran"
108,20250722,"Sem trabalho duro, nada cresce, apenas as ervas daninhas .","Gordon B. Hinckley"
109,20250723,"Em vez de se preocupar com o que você não pode mudar, vire a sua energia para o que você pode criar.","Roy T. Bennett"
110,20250724,"A tarefa mais importante de uma pessoa que vem ao mundo é criar algo.","Paulo Freire"
111,20250725,"Dentro de nós. Esse é o único lugar em que a felicidade perene pode ser encontrada.","Sri Prem Baba"
112,20250726,"Seu legado está sendo escrito por você. Tome as decisões corretas.","Gary Vaynerchuk"
113,20250727,"Para melhorar a qualidade de vida, melhore a qualidade de seus pensamentos.","Brian Tracy"
114,20250728,"Olhe atentamente para o presente que você está construindo: ele deve se parecer com o futuro com o qual você está sonhando.","Alice Walker"
115,20250729,"A história já nos mostrou que a coragem pode ser contagiosa e que a esperança pode ter vida própria.","Michelle Obama"
116,20250730,"Se você conviver com as galinhas, você vai cacarejar e se você conviver com as águias, você vai voar.","Steve Maraboli"
117,20250731,"Todos temos dentro de nós uma insuspeita reserva de força que emerge quando a vida nos põe à prova.","Isabel Allende"
118,20250801,"Quando você sair da tempestade, você não será a mesma pessoa que era quando entrou. Esse é o objetivo da tempestade.","Haruki Murakami"
119,20250802,"Deixe que doa. Deixe que sangre. Deixe que cure. E deixe para lá.","Nikita Gill"
120,20250803,"Você tem que treinar seu cérebro para ser positivo, assim como você treina seu corpo.","Shawn Achor"
121,20250804,"Eu amarei a luz, pois ela me mostra o caminho, mas suportarei a escuridão porque ela me mostra as estrelas.","Og Mandino"
122,20250805,"O que te machuca, te abençoa. A escuridão é a sua vela.","Rumi"
123,20250806,"Considere-se com sorte na próxima vez que encontrar o medo, pois é aí que surge a coragem.","Pema Chödrön"
124,20250807,"Não se pode caminhar em direção ao futuro com um pé no passado.","Marcio Kühne"
125,20250808,"Saber esperar é a arte de exercer liderança e obediência a você mesmo.","Roberto Reis"
126,20250809,"Abandone a pessoa que você acha que deve ser e seja você mesmo.","Brené Brown"
127,20250810,"Felicidade não é a crença de que não precisamos mudar, é a percepção de que podemos.","Shawn Achor"
128,20250811,"A excelência não é um destino, é uma viagem contínua que nunca termina.","Brian Tracy"
129,20250812,"A vida não fica mais fácil ou mais misericordiosa, nós é que ficamos mais fortes e resistentes.","Steve Maraboli"
130,20250813,"Sincronize os teus passos com o amor e siga em frente, ele sempre te leva aonde você precisa chegar.","Edna Frigato"
131,20250814,"A disciplina é a mãe do êxito.","Ésquilo"
132,20250815,"Só existe um êxito: a capacidade de levar a vida que se quer.","Cristopher Morley"
133,20250816,"O homem não teria alcançado o possível se, repetidas vezes, não tivesse tentado o impossível.","Max Weber"
134,20250817,"Transportai um punhado de terra todos os dias e fareis uma montanha.","Confúcio"
135,20250818,"Quando uma criatura humana desperta para um grande sonho e sobre ele lança toda a força de sua alma, todo o universo conspira a seu favor.","Johann Wolfgang von Goethe"
136,20250819,"Quem quer vencer um obstáculo deve armar-se da força do leão e da prudência da serpente.","Píndaro"
137,20250820,"Tudo o que a mente humana pode conceber, ela pode conquistar.","Napoleon Hill"
138,20250821,"A adversidade desperta em nós capacidades que, em circunstâncias favoráveis, teriam ficado adormecidas.","Horácio"
139,20250822,"É sempre a sua vez de fazer a próxima jogada.","Napoleon Hill"
140,20250823,"Habilidade é o que você é capaz de fazer. Motivação determina o que você faz. Atitude determina a qualidade do que você faz.","Lou Holtz"
141,20250824,"Crie a melhor, a mais grandiosa visão possível para sua vida, porque você se torna aquilo que você acredita.","Oprah Winfrey"
142,20250825,"Você só acertará aquilo que estiver na sua mira. Então mire alto!","Henry David Thoreau"
143,20250826,"⁠A menos que esteja disposto a experimentar coisas novas, você nunca vai descobrir todo o seu potencial.","Wim Hof"
144,20250827,"⁠Você não escolhe de onde vem, mas sempre tem o controle da direção para onde está indo.","Chris Colfer"
145,20250828,"Ação é a medida real da inteligência.","Napoleon Hill"
146,20250829,"⁠A coragem é algo que ninguém pode tirar de você.","Chris Colfer"
147,20250830,"O plano mais seguro é não depender da sorte.","Napoleon Hill"
148,20250831,"A ⁠transformação é um processo, não um evento.","John P. Kotter"
149,20250901,"Pessoas muito ocupadas sempre encontram tempo para tudo. Pelo contrário, pessoas preguiçosas nunca encontram tempo para nada.","Ernest Dimnet"
150,20250902,"⁠Nossos sucessos e fracassos vêm e vão - eles não nos definem nem determinam nosso valor.","Kristin Neff"
151,20250903,"Quando somos bons para os outros, somos ainda melhores para nós.","Benjamin Franklin"
152,20250904,"Nossos melhores sucessos vêm depois de nossas maiores decepções.","Henry Ward Beecher"
153,20250905,"O lucro do nosso estudo é tornarmo-nos melhores e mais sábios.","Michel de Montaigne"
154,20250906,"O homem que perdeu a estima por si mesmo deixa de ser bom para algo de grande ou magnânimo.","Giacomo Leopardi"
155,20250907,"Plante um pensamento, colha uma ação. Plante uma ação, colha um hábito. Plante um hábito, colha caráter. Plante caráter, colha um destino.","Stephen Covey"
156,20250908,"É melhor acender uma vela do que amaldiçoar a escuridão.","William L. Watkinson"
157,20250909,"⁠Continue curioso, continue estranho, continue gentil e não deixe ninguém dizer que você não é inteligente, corajoso ou digno o suficiente.","Alex Hirsch"
158,20250910,"⁠Não estou competindo com ninguém além de mim mesmo. Meu objetivo é melhorar continuamente.","Bill Gates"
159,20250911,"A felicidade não é um sentimento, é uma forma de ser.","Mark Rowlands"
160,20250912,"Você pode criar seu próprio final, independentemente do que aconteceu antes.","Stephanie Butland"
161,20250913,"⁠Quem você é, o que pensa, sente e faz, o que ama... É a soma daquilo em que você se concentra.","Cal Newport"
162,20250914,"⁠A sua ânsia de melhorar encontrará o caminho ideal para levá-lo à inteireza de seu ser.","Rogério Liporaci"
163,20250915,"⁠Tenha o sol em sua alma e a primavera em seus passos.","Rachel Bright"
164,20250916,"A felicidade não é algo que simplesmente acontece. É algo que nós fazemos acontecer.","Mihaly Csikszentmihalyi"
165,20250917,"⁠Procure bênçãos ocultas nas situações difíceis.","M. J. Ryan"
166,20250918,"⁠A felicidade não surge apenas ao aproveitar a vida de momento em momento, mas também da sensação de satisfação e fluxo que surge quando usamos as nossas capacidades ao máximo.","M. J. Ryan"
167,20250919,"Quando mudamos a forma de ver as coisas, as coisas mudam.","Esther Hicks"
168,20250920,"Não tenho medo de tempestades, porque estou aprendendo a navegar no meu navio.","Greer Hendricks"
169,20250921,"Tentar é a condição humana.","Jill Lepore"
170,20250922,"⁠Nada dura para sempre, exceto a mudança.","Nancy Springer"
171,20250923,"Viva, dance, ria, ame, corra, descubra, vibre, aproveite. Nunca perca de vista o principal: a história tem um fim.","Virginie Grimaldi"
172,20250924,"⁠Nossas vidas refletem nossos corações.","Shelby Mahurin"
173,20250925,"Vale sempre a pena repetir: vencedores constroem pontes. Perdedores constroem paredes.","House of Cards"
174,20250926,"A vida não é fácil para nenhum de nós. Temos que ter persistência e, acima de tudo, confiança em nós mesmos.","Marie Curie"
175,20250927,"Se você decidir que irá fazer apenas o que sabe que dará certo, estará deixando um monte de oportunidades para trás.","Jeff Bezos"
176,20250928,"Problemas existem para serem resolvidos, não para perturbar-nos.","Augusto Cury"
177,20250929,"Transforme sonho em suor, pensamento em ação.","Bráulio Bessa"
178,20250930,"Tudo é possível. O impossível apenas demora mais.","Dan Brown"
179,20251001,"O que você vê na sua mente é o que vai ter na mão.","Bob Proctor"
180,20251002,"Viva até às lágrimas.","Albert Camus"
181,20251003,"Mudanças incríveis acontecem em sua vida quando você decide tomar controle sobre o que tem poder, em vez de tentar controlar algo sobre o qual não tem poder.","Steve Maraboli"
182,20251004,"Liberte-se e veja as estrelas surgirem: do lado de fora e do lado de dentro.","Elizabeth Gilbert"
183,20251005,"Quando você tem uma meta, o que era obstáculo passa a ser etapa.","Marcio Kühne"
184,20251006,"A inteligência é a capacidade de se adaptar à mudança.","Stephen Hawking"
185,20251007,"A vida começa no final de sua zona de conforto.","Neale Donald Walsch"
186,20251008,"Você não encontra uma vida feliz. Você a cria.","Camilla Kimball"
187,20251009,"A felicidade costuma entrar sorrateiramente por uma porta que você não sabia que tinha deixado aberta.","John Barrymore"
188,20251010,"Vamos criar nosso futuro agora e tornar os nossos sonhos na realidade de amanhã.","Malala Yousafzai"
189,20251011,"Um campeão não é definido pelas suas vitórias, mas pelo modo como ele se recupera quando cai.","Serena Williams"
190,20251012,"O que pode mudar seu pensamento, pode mudar seu destino.","Stephen Covey"
191,20251013,"Oportunidades não acontecem, é você que cria.","Chris Grosser"
192,20251014,"O ponto de partida de toda conquista é a vontade.","Napoleon Hill"
193,20251015,"O sucesso é a soma de pequenos esforços repetidos.","Robert Collier"
194,20251016,"Sucesso é gostar de si mesmo, gostar do que você faz e gostar de como você faz.","Maya Angelou"
195,20251017,"O primeiro passo para o sucesso é dado quando você se recusa a ser prisioneiro do local onde você se encontra.","Mark Caine"
196,20251018,"Não aceito mais as coisas que não posso mudar, estou mudando as coisas que não posso aceitar.","Angela Davis"
197,20251019,"Você tem que agir como se fosse possível transformar radicalmente o mundo. E você tem que fazer isso o tempo todo.","Angela Davis"
198,20251020,"Você deve esperar grandes coisas de si mesmo antes de poder realizá-las.","Michael Jordan"
199,20251021,"Nosso maior medo não deve ser do fracasso, mas de ter sucesso nas coisas da vida que não importam.","Francis Chan"
200,20251022,"A felicidade não depende do que você é ou do que tem, mas exclusivamente do que você pensa.","Dale Carnegie"
201,20251023,"Você mede o tamanho da realização pelos obstáculos que teve de superar para atingir seus objetivos.","Booker T. Washington"
202,20251024,"O fracasso é o tempero que dá sabor ao sucesso.","Truman Capote"
203,20251025,"Quando tudo parecer estar indo contra você, lembre-se de que o avião decola contra o vento, não na direção dele.","Henry Ford"
204,20251026,"Seu tempo é limitado, então não o desperdice vivendo a vida de outra pessoa.","Steve Jobs"
205,20251027,"Tudo o que você sempre quis está do outro lado do medo.","George Addair"
206,20251028,"Não sou um produto das minhas circunstâncias. Sou um produto de minhas decisões.","Stephen Covey"
207,20251029,"A única maneira de fazer um ótimo trabalho é amar aquilo que você faz.","Steve Jobs"
208,20251030,"O futuro pertence àqueles que acreditam na beleza dos seus sonhos.","Eleanor Roosevelt"
209,20251031,"Não olhe para o relógio, faça o que ele faz: continue sempre.","Sam Levenson"
210,20251101,"Eu sou o mestre de meu destino. Eu sou o capitão de minha alma.","William Ernest Henley"
211,20251102,"A melhor maneira de nos prepararmos para o futuro é concentrar toda a imaginação e entusiasmo na execução perfeita do trabalho de hoje.","Dale Carnegie"
212,20251103,"Não há santo sem passado, nem pecador sem futuro.","Santo Agostinho"
213,20251104,"O que quer que você seja, seja o melhor.","Abraham Lincoln"
214,20251105,"O passado não é igual ao futuro.","Tony Robbins"
215,20251106,"Estaremos duas vezes armados se lutarmos com fé.","Platão"
216,20251107,"Até a mente mais sábia ainda tem algo para aprender.","George Santayana"
217,20251108,"Quem olha para fora, sonha; quem olha para dentro, acorda.","Carl Jung"
218,20251109,"O momento mais assustador é sempre antes de você começar.","Stephen King"
219,20251110,"Os caminhos se fazem caminhando.","Franz Kafka"
220,20251111,"A diligência é a mãe da boa sorte.","Miguel de Cervantes"
221,20251112,"Você é a pessoa por quem você estava esperando.","Joe Dispenza"
222,20251113,"Se você é livre, precisa libertar outra pessoa. Se você tem algum poder, sua missão é empoderar outra pessoa.","Toni Morrison"
223,20251114,"Escute, sorria, concorde e depois faça o que você quiser.","Robert Downey Jr"
224,20251115,"Nosso destino não está escrito nas estrelas, mas em nós mesmos...","William Shakespeare"
225,20251116,"Não há nada de nobre em ser superior a seus semelhantes; a verdadeira nobreza é ser superior a quem você era.","Ernest Hemingway"
226,20251117,"Pessoas extremas obtêm resultados extremos.","Sam Altman"
227,20251118,"A adversidade revela o gênio, a prosperidade o oculta.","Horácio"
228,20251119,"Embora o mundo esteja cheio de sofrimento, ele também está cheio de superação.","Helen Keller"
229,20251120,"De uma forma suave, você pode agitar o mundo.","Mahatma Gandhi"
230,20251121,"O segredo de ficar na frente é começar.","Mark Twain"
231,20251122,"Um navio no porto está seguro, mas não é para isso que os navios são construídos.","John A. Shedd"
232,20251123,"Mire na lua e, se errar, você ainda estará entre as estrelas.","Les Brown"
233,20251124,"Nem todos os que vagueiam estão perdidos.","J. R. R. Tolkien"
234,20251125,"Você não precisa ver toda a escada, basta dar o primeiro passo.","Martin Luther King Jr."
235,20251126,"Ocupe-se vivendo ou ocupe-se morrendo.","Stephen King"
236,20251127,"Nós somos nossas escolhas.","Jean-Paul Sartre"
237,20251128,"Você pode ser feliz onde está.","Joel Osteen"
238,20251129,"Você muda o mundo sendo você mesmo.","Yoko Ono"
239,20251130,"Um grama de ação vale uma tonelada de teoria.","Friedrich Engels"
240,20251201,"A vida começa do outro lado do desespero.","Jean-Paul Sartre"
241,20251202,"Não temos medo do futuro. Estamos aqui para moldá-lo.","Barack Obama"
242,20251203,"Não é o tamanho do cachorro na luta, mas o tamanho da luta no cachorro.","Mark Twain"
243,20251204,"Os homens mais sábios seguem sua própria direção.","Eurípides"
