id,index,quote,author
244,20251205,"Para se encontrar, pense por si mesmo.","Sócrates"
245,20251206,"A verdade, a bondade e a beleza são apenas faces diferentes de uma mesma coisa.","Ralph Waldo Emerson"
246,20251207,"Você não pode encontrar a paz evitando a vida.","Virgínia Woolf"
247,20251208,"Apenas confie em si mesmo e você saberá como viver.","Johann Wolfgang von Goethe"
248,20251209,"Escutando seu próprio coração, você começará a se mover na direção certa.","Osho"
249,20251210,"O mundo quebra todos nós, e depois, alguns se tornam mais fortes nos lugares que foram quebrados.","Ernest Hemingway"
250,20251211,"Os erros são portais para a descoberta.","James Joyce"
251,20251212,"É preciso coragem para crescer e se tornar quem você realmente é.","E.E. Cummings"
252,20251213,"A clareza precede o sucesso.","Robin Sharma"
253,20251214,"A autoconfiança é a memória do sucesso.","David Storey"
254,20251215,"Excelência não é uma habilidade, é uma atitude.","Ralph Marston"
255,20251216,"Esperança é conseguir ver que há luz apesar de todas as trevas.","Desmond Tutu"
256,20251217,"Você não pode esperar por inspiração. Você tem que ir atrás dela.","Jack London"
257,20251218,"Não podemos curar o mundo de suas dores, mas podemos escolher viver com alegria.","Joseph Campbell"
258,20251219,"Adote o ritmo da natureza: o segredo dela é a paciência.","Ralph Waldo Emerson"
259,20251220,"Beleza é poder; um sorriso é sua espada.","John Ray"
260,20251221,"Confie nos sonhos, pois neles está oculta a porta para a eternidade.","Khalil Gibran"
261,20251222,"Pérolas não aparecem na praia. Se você quiser uma, precisa mergulhar.","Provérbio chinês"
262,20251223,"Não podemos recuperar o ontem, mas podemos ganhar ou perder o amanhã.","Lyndon B. Johnson"
263,20251224,"O pessimismo leva à fraqueza, o otimismo ao poder.","William James"
264,20251225,"Em cada dia, existem 1440 minutos. Isso significa que temos 1440 oportunidades diárias de causar um impacto positivo.","Les Brown"
265,20251226,"O otimismo perpétuo é uma força multiplicadora.","Colin Powell"
266,20251227,"Depois que você escolhe a esperança, tudo é possivel.","Christopher Reeve"
267,20251228,"Milagres acontecem com aqueles que acreditam neles.","Bernhard Berenson"
268,20251229,"Tenha grandes pensamentos, mas aprecie os pequenos prazeres.","H. Jackson Brown"
269,20251230,"Tudo o que não nos destrói, torna-nos mais fortes...","Friedrich Nietzsche"
270,20251231,"Eu irei a qualquer lugar, contanto que seja para a frente.","David Livingston"
271,20260101,"Milagres nascem da convicção.","Marianne Williamson"
272,20260102,"Este pode ser o primeiro dia de sua nova vida.","Robin Sharma"
273,20260103,"Você é a alegria procurando uma forma de se expressar.","Esther Hicks"
274,20260104,"Uma alegria espanta cem tristezas.","Provérbio chinês"